sku,id_producto,nombre_producto,modelo,color,talla,categoria,marca,precio_venta,costo,fecha,tipo_producto,unidad_medida,codigo_barras,Tipo_producto_afecta_inventario
ACT-0191,5829,CARDIGAN DE ENCAJE BEIGE,,,,CARDIGAN,ACTIVE USA,335,279,2025-07-04,Inventariable,Pieza,50005829,TRUE
ACT-0192,5830,CROP TOP CON BOTONES FRONTALES MOSTAZA,,,,CROP,ACTIVE USA,146,112,2025-07-04,Inventariable,Pieza,50005830,TRUE
ACT-0193,5831,CARDIGAN DE ENCAJE BURDEOS,,,,CARDIGAN,ACTIVE USA,216,180,2025-07-04,Inventariable,Pieza,50005831,TRUE
ACT-0194,5832,CARDIGAN CON ESTAMPADO FLORAL VERDE ESMERALDA,,,,CARDIGAN,ACTIVE USA,318,265,2025-07-04,Inventariable,Pieza,50005832,TRUE
ACT-0195,5833,SHORT CON CUELLO EN V NEGRO,,,,SHORT,ACTIVE USA,276,230,2025-07-04,Inventariable,Pieza,50005833,TRUE
ACT-0196,5834,TOP ACANALADO LILA,,,,TOP,ACTIVE USA,164,126,2025-07-04,Inventariable,Pieza,50005834,TRUE
ACT-0197,5835,CAMISA MANGA OBISPO BURDEOS,,,,CAMISA,ACTIVE USA,377,314,2025-07-04,Inventariable,Pieza,50005835,TRUE
ACT-0198,5836,SHORT DE ENCAJE VERDE ESMERALDA,,,,SHORT,ACTIVE USA,372,310,2025-07-04,Inventariable,Pieza,50005836,TRUE
ACT-0199,5837,CAMISA DE TEJIDO DENIM AZUL CIELO,,,,CAMISA,ACTIVE USA,245,204,2025-07-04,Inventariable,Pieza,50005837,TRUE
ACT-0200,5838,BLUSA CON CUELLO EN V VERDE ESMERALDA,,,,BLUSA,ACTIVE USA,244,203,2025-07-04,Inventariable,Pieza,50005838,TRUE
RUN-0040,5839,FALDA MANGA OBISPO BEIGE,,,,FALDA,RUNWAYPARIS,208,173,2025-07-04,Inventariable,Pieza,50005839,TRUE
RUN-0041,5840,BLUSA MANGA OBISPO AZUL MARINO,,,,BLUSA,RUNWAYPARIS,238,198,2025-07-04,Inventariable,Pieza,50005840,TRUE
RUN-0042,5841,ENTERIZO CON ESTAMPADO FLORAL BEIGE,,,,ENTERIZO,RUNWAYPARIS,198,152,2025-07-04,Inventariable,Pieza,50005841,TRUE
RUN-0043,5842,CAMISA CON LAZADA MOSTAZA,,,,CAMISA,RUNWAYPARIS,224,186,2025-07-04,Inventariable,Pieza,50005842,TRUE
RUN-0044,5843,VESTIDO PLISADO BURDEOS,,,,VESTIDO,RUNWAYPARIS,207,159,2025-07-04,Inventariable,Pieza,50005843,TRUE
RUN-0045,5844,ENTERIZO OVERSIZE CREMA,,,,ENTERIZO,RUNWAYPARIS,194,149,2025-07-04,Inventariable,Pieza,50005844,TRUE
RUN-0046,5845,CAMISA DE TEJIDO DENIM NEGRO,,,,CAMISA,RUNWAYPARIS,251,209,2025-07-04,Inventariable,Pieza,50005845,TRUE
RUN-0047,5846,TOP CON BOTONES FRONTALES BLANCO,,,,TOP,RUNWAYPARIS,316,263,2025-07-04,Inventariable,Pieza,50005846,TRUE
RUN-0048,5847,PANTALON SATINADO AZUL CIELO,,,,PANTALON,RUNWAYPARIS,310,258,2025-07-04,Inventariable,Pieza,50005847,TRUE
ONE-0042,5848,FALDA CON BORDADO SUIZO BEIGE,,,,FALDA,ONE N MORE,632,549,2025-07-04,Inventariable,Pieza,50005848,TRUE
ONE-0043,5849,VESTIDO CON BORDADO SUIZO AZUL CIELO,,,,VESTIDO,ONE N MORE,592,514,2025-07-04,Inventariable,Pieza,50005849,TRUE
ONE-0044,5850,SHORT ACANALADO MOSTAZA,,,,SHORT,ONE N MORE,405,352,2025-07-04,Inventariable,Pieza,50005850,TRUE
ONE-0045,5851,CAMISA SATINADO TERRACOTA,,,,CAMISA,ONE N MORE,409,355,2025-07-04,Inventariable,Pieza,50005851,TRUE
GEE-0020,5852,ENTERIZO OVERSIZE CREMA,,,,ENTERIZO,GEEGEE,318,265,2025-07-04,Inventariable,Pieza,50005852,TRUE
GEE-0021,5853,PANTALON DE TEJIDO DENIM NEGRO,,,,PANTALON,GEEGEE,318,265,2025-07-04,Inventariable,Pieza,50005853,TRUE
LOT-0134,5854,TOP ACANALADO MOSTAZA,,,,TOP,LOVE TREE,324,270,2025-07-05,Inventariable,Pieza,50005854,TRUE
LOT-0135,5855,BLUSA DE LINO AZUL MARINO,,,,BLUSA,LOVE TREE,221,184,2025-07-05,Inventariable,Pieza,50005855,TRUE
LOT-0136,5856,BLUSA CON BOTONES FRONTALES MOSTAZA,,,,BLUSA,LOVE TREE,305,254,2025-07-05,Inventariable,Pieza,50005856,TRUE
LOT-0137,5857,CROP TOP PLISADO BURDEOS,,,,CROP,LOVE TREE,252,210,2025-07-05,Inventariable,Pieza,50005857,TRUE
LOT-0138,5858,BLUSA DE TEJIDO DENIM GRIS JASPE,,,,BLUSA,LOVE TREE,210,175,2025-07-05,Inventariable,Pieza,50005858,TRUE
LOT-0139,5859,BLUSA AJUSTADO LILA,,,,BLUSA,LOVE TREE,250,208,2025-07-05,Inventariable,Pieza,50005859,TRUE
LOT-0140,5860,CARDIGAN CON LAZADA NEGRO,,,,CARDIGAN,LOVE TREE,314,261,2025-07-05,Inventariable,Pieza,50005860,TRUE
LOT-0141,5861,CROP TOP CON OLANES AZUL CIELO,,,,CROP,LOVE TREE,218,181,2025-07-05,Inventariable,Pieza,50005861,TRUE
LOT-0142,5862,CAMISA SATINADO GRIS JASPE,,,,CAMISA,LOVE TREE,176,135,2025-07-05,Inventariable,Pieza,50005862,TRUE
LOT-0143,5863,ENTERIZO DE CORTE RECTO TERRACOTA,,,,ENTERIZO,LOVE TREE,204,170,2025-07-05,Inventariable,Pieza,50005863,TRUE
TRE-0019,5864,PANTALON DE CORTE RECTO BLANCO,,,,PANTALON,TREND STYLES,195,150,2025-07-05,Inventariable,Pieza,50005864,TRUE
TRE-0020,5865,ENTERIZO CON BOTONES FRONTALES BEIGE,,,,ENTERIZO,TREND STYLES,180,138,2025-07-05,Inventariable,Pieza,50005865,TRUE
MIA-0033,5866,PANTALON PLISADO AZUL CIELO,,,,PANTALON,MIASMIAS,219,182,2025-07-05,Inventariable,Pieza,50005866,TRUE
MIA-0034,5867,SHORT AJUSTADO ROSA PASTEL,,,,SHORT,MIASMIAS,219,182,2025-07-05,Inventariable,Pieza,50005867,TRUE
MIA-0035,5868,FALDA MANGA OBISPO GRIS JASPE,,,,FALDA,MIASMIAS,219,182,2025-07-05,Inventariable,Pieza,50005868,TRUE
EST-0027,5869,SHORT DE TEJIDO DENIM ROSA PASTEL,,,,SHORT,ESTELLA,380,330,2025-07-05,Inventariable,Pieza,50005869,TRUE
EST-0028,5870,CAMISA CON BORDADO SUIZO VERDE ESMERALDA,,,,CAMISA,ESTELLA,238,198,2025-07-05,Inventariable,Pieza,50005870,TRUE
EST-0029,5871,PANTALON CON CUELLO EN V VERDE ESMERALDA,,,,PANTALON,ESTELLA,341,284,2025-07-05,Inventariable,Pieza,50005871,TRUE
EST-0030,5872,TOP AJUSTADO BLANCO,,,,TOP,ESTELLA,208,173,2025-07-05,Inventariable,Pieza,50005872,TRUE
EST-0031,5873,CARDIGAN CON ESTAMPADO FLORAL BURDEOS,,,,CARDIGAN,ESTELLA,272,226,2025-07-05,Inventariable,Pieza,50005873,TRUE
EST-0032,5874,TOP CON LAZADA LILA,,,,TOP,ESTELLA,206,171,2025-07-05,Inventariable,Pieza,50005874,TRUE
EST-0033,5875,PANTALON CON ESTAMPADO FLORAL ROSA PASTEL,,,,PANTALON,ESTELLA,291,242,2025-07-05,Inventariable,Pieza,50005875,TRUE
CIS-0017,5876,SHORT DE CORTE RECTO AZUL CIELO,,,,SHORT,CI SONO CORDUROY,257,214,2025-07-05,Inventariable,Pieza,50005876,TRUE
CIS-0018,5877,TOP PLISADO BLANCO,,,,TOP,CI SONO CORDUROY,256,213,2025-07-05,Inventariable,Pieza,50005877,TRUE
ACG-0088,5878,PANTALON MANGA OBISPO AZUL MARINO,,,,PANTALON,ACG,273,227,2025-07-05,Inventariable,Pieza,50005878,TRUE
ACG-0089,5879,CAMISA CON LAZADA AZUL MARINO,,,,CAMISA,ACG,249,207,2025-07-05,Inventariable,Pieza,50005879,TRUE
ACG-0090,5880,BLUSA ACANALADO TERRACOTA,,,,BLUSA,ACG,212,163,2025-07-05,Inventariable,Pieza,50005880,TRUE
ACG-0091,5881,PANTALON CON OLANES GRIS JASPE,,,,PANTALON,ACG,248,206,2025-07-05,Inventariable,Pieza,50005881,TRUE
ACG-0092,5882,TOP CON ESTAMPADO FLORAL BLANCO,,,,TOP,ACG,203,169,2025-07-05,Inventariable,Pieza,50005882,TRUE
ACG-0093,5883,TOP DE TEJIDO DENIM LILA,,,,TOP,ACG,267,222,2025-07-05,Inventariable,Pieza,50005883,TRUE
ACG-0094,5884,CROP TOP CON CUELLO EN V CREMA,,,,CROP,ACG,215,165,2025-07-05,Inventariable,Pieza,50005884,TRUE
ACG-0095,5885,BLUSA DE CORTE RECTO GRIS JASPE,,,,BLUSA,ACG,203,156,2025-07-05,Inventariable,Pieza,50005885,TRUE
ACG-0096,5886,CROP TOP OVERSIZE AZUL CIELO,,,,CROP,ACG,275,229,2025-07-05,Inventariable,Pieza,50005886,TRUE
GIL-0038,5887,CARDIGAN CON CUELLO EN V AZUL CIELO,,,,CARDIGAN,GILLI,376,313,2025-07-05,Inventariable,Pieza,50005887,TRUE
GIL-0039,5888,CROP TOP PLISADO AZUL MARINO,,,,CROP,GILLI,366,305,2025-07-05,Inventariable,Pieza,50005888,TRUE
GIL-0040,5889,FALDA MANGA OBISPO TERRACOTA,,,,FALDA,GILLI,302,251,2025-07-05,Inventariable,Pieza,50005889,TRUE
GIL-0041,5890,CARDIGAN DE TEJIDO DENIM MOSTAZA,,,,CARDIGAN,GILLI,378,315,2025-07-05,Inventariable,Pieza,50005890,TRUE
LEE-0075,5891,CARDIGAN ACANALADO CREMA,,,,CARDIGAN,LEENA,402,349,2025-07-05,Inventariable,Pieza,50005891,TRUE
LEE-0076,5892,CROP TOP CON BORDADO SUIZO VERDE ESMERALDA,,,,CROP,LEENA,431,374,2025-07-05,Inventariable,Pieza,50005892,TRUE
LEE-0077,5893,VESTIDO CON BORDADO SUIZO VERDE ESMERALDA,,,,VESTIDO,LEENA,273,227,2025-07-05,Inventariable,Pieza,50005893,TRUE
LEE-0078,5894,CAMISA DE TEJIDO DENIM BEIGE,,,,CAMISA,LEENA,478,415,2025-07-05,Inventariable,Pieza,50005894,TRUE
LEE-0079,5895,CARDIGAN CON BOTONES FRONTALES MOSTAZA,,,,CARDIGAN,LEENA,462,401,2025-07-05,Inventariable,Pieza,50005895,TRUE
LEE-0080,5896,BLUSA DE CORTE RECTO BEIGE,,,,BLUSA,LEENA,226,188,2025-07-05,Inventariable,Pieza,50005896,TRUE
LEE-0081,5897,TOP DE LINO AZUL MARINO,,,,TOP,LEENA,335,279,2025-07-05,Inventariable,Pieza,50005897,TRUE
LEE-0082,5898,BLUSA AJUSTADO CREMA,,,,BLUSA,LEENA,362,301,2025-07-05,Inventariable,Pieza,50005898,TRUE
LOL-0060,5899,VESTIDO DE TEJIDO DENIM GRIS JASPE,,,,VESTIDO,LOLA,254,211,2025-07-05,Inventariable,Pieza,50005899,TRUE
LOL-0061,5900,CAMISA DE ENCAJE ROSA PASTEL,,,,CAMISA,LOLA,242,201,2025-07-05,Inventariable,Pieza,50005900,TRUE
LOL-0062,5901,TOP CON ESTAMPADO FLORAL LILA,,,,TOP,LOLA,262,218,2025-07-05,Inventariable,Pieza,50005901,TRUE
LOL-0063,5902,SHORT ACANALADO BEIGE,,,,SHORT,LOLA,244,203,2025-07-05,Inventariable,Pieza,50005902,TRUE
OVE-0068,5903,CARDIGAN DE TEJIDO DENIM LILA,,,,CARDIGAN,OVER APPAREL,249,207,2025-07-05,Inventariable,Pieza,50005903,TRUE
OVE-0069,5904,CARDIGAN OVERSIZE GRIS JASPE,,,,CARDIGAN,OVER APPAREL,209,174,2025-07-05,Inventariable,Pieza,50005904,TRUE
OVE-0070,5905,CAMISA CON BORDADO SUIZO GRIS JASPE,,,,CAMISA,OVER APPAREL,192,147,2025-07-05,Inventariable,Pieza,50005905,TRUE
OVE-0071,5906,ENTERIZO DE ENCAJE AZUL MARINO,,,,ENTERIZO,OVER APPAREL,251,209,2025-07-05,Inventariable,Pieza,50005906,TRUE
OVE-0072,5907,BLUSA DE CORTE RECTO BURDEOS,,,,BLUSA,OVER APPAREL,205,157,2025-07-05,Inventariable,Pieza,50005907,TRUE
OVE-0073,5908,FALDA AJUSTADO BEIGE,,,,FALDA,OVER APPAREL,238,198,2025-07-05,Inventariable,Pieza,50005908,TRUE
OVE-0074,5909,CAMISA DE TEJIDO DENIM AZUL CIELO,,,,CAMISA,OVER APPAREL,181,139,2025-07-05,Inventariable,Pieza,50005909,TRUE
OVE-0075,5910,FALDA MANGA OBISPO LILA,,,,FALDA,OVER APPAREL,257,214,2025-07-05,Inventariable,Pieza,50005910,TRUE
OVE-0076,5911,FALDA MANGA OBISPO MOSTAZA,,,,FALDA,OVER APPAREL,213,177,2025-07-05,Inventariable,Pieza,50005911,TRUE
OVE-0077,5912,BLUSA DE LINO VERDE ESMERALDA,,,,BLUSA,OVER APPAREL,207,159,2025-07-05,Inventariable,Pieza,50005912,TRUE
OVE-0078,5913,PANTALON CON ESTAMPADO FLORAL CREMA,,,,PANTALON,OVER APPAREL,274,228,2025-07-05,Inventariable,Pieza,50005913,TRUE
BLA-0052,5914,ENTERIZO MANGA OBISPO BLANCO,,,,ENTERIZO,BLASHE,186,143,2025-07-05,Inventariable,Pieza,50005914,TRUE
BLA-0053,5915,SHORT CON BORDADO SUIZO GRIS JASPE,,,,SHORT,BLASHE,212,163,2025-07-05,Inventariable,Pieza,50005915,TRUE
BLA-0054,5916,CARDIGAN CON OLANES ROSA PASTEL,,,,CARDIGAN,BLASHE,254,211,2025-07-05,Inventariable,Pieza,50005916,TRUE
BLA-0055,5917,SHORT CON BOTONES FRONTALES ROSA PASTEL,,,,SHORT,BLASHE,243,202,2025-07-05,Inventariable,Pieza,50005917,TRUE
BLA-0056,5918,TOP CON LAZADA CREMA,,,,TOP,BLASHE,227,189,2025-07-05,Inventariable,Pieza,50005918,TRUE
MIS-0011,5919,ENTERIZO CON CUELLO EN V MOSTAZA,,,,ENTERIZO,MISTYROSE,308,256,2025-07-05,Inventariable,Pieza,50005919,TRUE
MIS-0012,5920,PANTALON CON BORDADO SUIZO BEIGE,,,,PANTALON,MISTYROSE,308,256,2025-07-05,Inventariable,Pieza,50005920,TRUE
IJO-0058,5921,TOP CON LAZADA NEGRO,,,,TOP,IJOAH,354,295,2025-07-05,Inventariable,Pieza,50005921,TRUE
IJO-0059,5922,BLUSA DE ENCAJE VERDE ESMERALDA,,,,BLUSA,IJOAH,273,227,2025-07-05,Inventariable,Pieza,50005922,TRUE
IJO-0060,5923,BLUSA OVERSIZE VERDE ESMERALDA,,,,BLUSA,IJOAH,345,287,2025-07-05,Inventariable,Pieza,50005923,TRUE
IJO-0061,5924,TOP PLISADO TERRACOTA,,,,TOP,IJOAH,333,277,2025-07-05,Inventariable,Pieza,50005924,TRUE
IJO-0062,5925,CARDIGAN PLISADO AZUL CIELO,,,,CARDIGAN,IJOAH,354,295,2025-07-05,Inventariable,Pieza,50005925,TRUE
IJO-0063,5926,VESTIDO DE ENCAJE LILA,,,,VESTIDO,IJOAH,351,292,2025-07-05,Inventariable,Pieza,50005926,TRUE
IJO-0064,5927,FALDA CON OLANES BLANCO,,,,FALDA,IJOAH,348,290,2025-07-05,Inventariable,Pieza,50005927,TRUE
IJO-0065,5928,CARDIGAN PLISADO AZUL MARINO,,,,CARDIGAN,IJOAH,190,146,2025-07-05,Inventariable,Pieza,50005928,TRUE
IJO-0066,5929,CARDIGAN DE ENCAJE AZUL MARINO,,,,CARDIGAN,IJOAH,268,223,2025-07-05,Inventariable,Pieza,50005929,TRUE
IJO-0067,5930,ENTERIZO DE TEJIDO DENIM GRIS JASPE,,,,ENTERIZO,IJOAH,255,212,2025-07-05,Inventariable,Pieza,50005930,TRUE
NAA-0030,5931,PANTALON CON OLANES BLANCO,,,,PANTALON,NAANAA,296,246,2025-07-05,Inventariable,Pieza,50005931,TRUE
NAA-0031,5932,FALDA CON BOTONES FRONTALES MOSTAZA,,,,FALDA,NAANAA,364,303,2025-07-05,Inventariable,Pieza,50005932,TRUE
NAA-0032,5933,FALDA DE CORTE RECTO BURDEOS,,,,FALDA,NAANAA,293,244,2025-07-05,Inventariable,Pieza,50005933,TRUE
NAA-0033,5934,PANTALON CON ESTAMPADO FLORAL AZUL MARINO,,,,PANTALON,NAANAA,298,248,2025-07-05,Inventariable,Pieza,50005934,TRUE
NAA-0034,5935,PANTALON DE TEJIDO DENIM AZUL MARINO,,,,PANTALON,NAANAA,334,278,2025-07-05,Inventariable,Pieza,50005935,TRUE
NAA-0035,5936,ENTERIZO MANGA OBISPO ROSA PASTEL,,,,ENTERIZO,NAANAA,315,262,2025-07-05,Inventariable,Pieza,50005936,TRUE
NAA-0036,5937,PANTALON CON BOTONES FRONTALES BURDEOS,,,,PANTALON,NAANAA,350,291,2025-07-05,Inventariable,Pieza,50005937,TRUE
NAA-0037,5938,FALDA DE LINO ROSA PASTEL,,,,FALDA,NAANAA,249,207,2025-07-05,Inventariable,Pieza,50005938,TRUE
EDI-0051,5939,TOP PLISADO MOSTAZA,,,,TOP,EDIT BY NINE,488,424,2025-07-05,Inventariable,Pieza,50005939,TRUE
EDI-0052,5940,CROP TOP CON BORDADO SUIZO VERDE ESMERALDA,,,,CROP,EDIT BY NINE,493,428,2025-07-05,Inventariable,Pieza,50005940,TRUE
EDI-0053,5941,CROP TOP PLISADO TERRACOTA,,,,CROP,EDIT BY NINE,250,208,2025-07-05,Inventariable,Pieza,50005941,TRUE
EDI-0054,5942,SHORT CON BOTONES FRONTALES CREMA,,,,SHORT,EDIT BY NINE,284,236,2025-07-05,Inventariable,Pieza,50005942,TRUE
EDI-0055,5943,PANTALON PLISADO LILA,,,,PANTALON,EDIT BY NINE,356,296,2025-07-05,Inventariable,Pieza,50005943,TRUE
EDI-0056,5944,CARDIGAN CON OLANES AZUL MARINO,,,,CARDIGAN,EDIT BY NINE,449,390,2025-07-05,Inventariable,Pieza,50005944,TRUE
HAV-0067,5945,PANTALON DE CORTE RECTO VERDE ESMERALDA,,,,PANTALON,HAVE,198,152,2025-07-05,Inventariable,Pieza,50005945,TRUE
HAV-0068,5946,FALDA CON BORDADO SUIZO CREMA,,,,FALDA,HAVE,211,162,2025-07-05,Inventariable,Pieza,50005946,TRUE
HAV-0069,5947,CAMISA DE CORTE RECTO MOSTAZA,,,,CAMISA,HAVE,321,267,2025-07-05,Inventariable,Pieza,50005947,TRUE
HAV-0070,5948,ENTERIZO CON BORDADO SUIZO TERRACOTA,,,,ENTERIZO,HAVE,215,179,2025-07-05,Inventariable,Pieza,50005948,TRUE
HAV-0071,5949,TOP CON BOTONES FRONTALES MOSTAZA,,,,TOP,HAVE,330,275,2025-07-05,Inventariable,Pieza,50005949,TRUE
HAV-0072,5950,CARDIGAN DE CORTE RECTO AZUL CIELO,,,,CARDIGAN,HAVE,273,227,2025-07-05,Inventariable,Pieza,50005950,TRUE
HAV-0073,5951,FALDA CON CUELLO EN V BLANCO,,,,FALDA,HAVE,197,151,2025-07-05,Inventariable,Pieza,50005951,TRUE
HAV-0074,5952,BLUSA DE ENCAJE BURDEOS,,,,BLUSA,HAVE,216,166,2025-07-05,Inventariable,Pieza,50005952,TRUE
HAV-0075,5953,SHORT PLISADO NEGRO,,,,SHORT,HAVE,345,287,2025-07-05,Inventariable,Pieza,50005953,TRUE
HAV-0076,5954,ENTERIZO CON OLANES CREMA,,,,ENTERIZO,HAVE,280,233,2025-07-05,Inventariable,Pieza,50005954,TRUE
SHE-0079,5955,CAMISA SATINADO LILA,,,,CAMISA,SHERO,359,299,2025-07-06,Inventariable,Pieza,50005955,TRUE
SHE-0080,5956,VESTIDO DE LINO CREMA,,,,VESTIDO,SHERO,251,209,2025-07-06,Inventariable,Pieza,50005956,TRUE
SHE-0081,5957,SHORT CON OLANES VERDE ESMERALDA,,,,SHORT,SHERO,298,248,2025-07-06,Inventariable,Pieza,50005957,TRUE
SHE-0082,5958,CROP TOP ACANALADO CREMA,,,,CROP,SHERO,303,252,2025-07-06,Inventariable,Pieza,50005958,TRUE
SHE-0083,5959,CROP TOP MANGA OBISPO NEGRO,,,,CROP,SHERO,204,170,2025-07-06,Inventariable,Pieza,50005959,TRUE
SHE-0084,5960,PANTALON CON LAZADA NEGRO,,,,PANTALON,SHERO,369,307,2025-07-06,Inventariable,Pieza,50005960,TRUE
SHE-0085,5961,CROP TOP ACANALADO CREMA,,,,CROP,SHERO,238,198,2025-07-06,Inventariable,Pieza,50005961,TRUE
SHE-0086,5962,CAMISA MANGA OBISPO VERDE ESMERALDA,,,,CAMISA,SHERO,292,243,2025-07-06,Inventariable,Pieza,50005962,TRUE
SHE-0087,5963,PANTALON PLISADO MOSTAZA,,,,PANTALON,SHERO,327,272,2025-07-06,Inventariable,Pieza,50005963,TRUE
SHE-0088,5964,CROP TOP MANGA OBISPO MOSTAZA,,,,CROP,SHERO,360,300,2025-07-06,Inventariable,Pieza,50005964,TRUE
SHE-0089,5965,BLUSA CON BORDADO SUIZO NEGRO,,,,BLUSA,SHERO,353,294,2025-07-06,Inventariable,Pieza,50005965,TRUE
SHE-0090,5966,BLUSA CON BORDADO SUIZO BEIGE,,,,BLUSA,SHERO,274,228,2025-07-06,Inventariable,Pieza,50005966,TRUE
INA-0017,5967,CAMISA SATINADO VERDE ESMERALDA,,,,CAMISA,INA,353,294,2025-07-06,Inventariable,Pieza,50005967,TRUE
INA-0018,5968,FALDA CON CUELLO EN V GRIS JASPE,,,,FALDA,INA,336,280,2025-07-06,Inventariable,Pieza,50005968,TRUE
AVA-0075,5969,CROP TOP MANGA OBISPO AZUL MARINO,,,,CROP,AVAILABLE,214,178,2025-07-06,Inventariable,Pieza,50005969,TRUE
AVA-0076,5970,SHORT DE LINO ROSA PASTEL,,,,SHORT,AVAILABLE,202,155,2025-07-06,Inventariable,Pieza,50005970,TRUE
AVA-0077,5971,CROP TOP DE LINO ROSA PASTEL,,,,CROP,AVAILABLE,216,166,2025-07-06,Inventariable,Pieza,50005971,TRUE
AVA-0078,5972,VESTIDO CON ESTAMPADO FLORAL AZUL CIELO,,,,VESTIDO,AVAILABLE,213,177,2025-07-06,Inventariable,Pieza,50005972,TRUE
AVA-0079,5973,PANTALON CON OLANES BEIGE,,,,PANTALON,AVAILABLE,189,145,2025-07-06,Inventariable,Pieza,50005973,TRUE
AVA-0080,5974,SHORT ACANALADO TERRACOTA,,,,SHORT,AVAILABLE,185,142,2025-07-06,Inventariable,Pieza,50005974,TRUE
GAL-0056,5975,VESTIDO OVERSIZE AZUL CIELO,,,,VESTIDO,GALITA,206,171,2025-07-06,Inventariable,Pieza,50005975,TRUE
GAL-0057,5976,PANTALON OVERSIZE BURDEOS,,,,PANTALON,GALITA,435,378,2025-07-06,Inventariable,Pieza,50005976,TRUE
GAL-0058,5977,CAMISA CON BORDADO SUIZO AZUL MARINO,,,,CAMISA,GALITA,278,231,2025-07-06,Inventariable,Pieza,50005977,TRUE
GAL-0059,5978,CAMISA DE CORTE RECTO GRIS JASPE,,,,CAMISA,GALITA,474,412,2025-07-06,Inventariable,Pieza,50005978,TRUE
GAL-0060,5979,CARDIGAN CON ESTAMPADO FLORAL LILA,,,,CARDIGAN,GALITA,208,160,2025-07-06,Inventariable,Pieza,50005979,TRUE
GAL-0061,5980,BLUSA CON BOTONES FRONTALES TERRACOTA,,,,BLUSA,GALITA,374,311,2025-07-06,Inventariable,Pieza,50005980,TRUE
GAL-0062,5981,CAMISA SATINADO VERDE ESMERALDA,,,,CAMISA,GALITA,401,348,2025-07-06,Inventariable,Pieza,50005981,TRUE
GAL-0063,5982,CROP TOP DE LINO BEIGE,,,,CROP,GALITA,373,324,2025-07-06,Inventariable,Pieza,50005982,TRUE
GAL-0064,5983,PANTALON ACANALADO MOSTAZA,,,,PANTALON,GALITA,327,272,2025-07-06,Inventariable,Pieza,50005983,TRUE
GAL-0065,5984,BLUSA DE TEJIDO DENIM AZUL CIELO,,,,BLUSA,GALITA,282,235,2025-07-06,Inventariable,Pieza,50005984,TRUE
GAL-0066,5985,VESTIDO CON BOTONES FRONTALES GRIS JASPE,,,,VESTIDO,GALITA,230,191,2025-07-06,Inventariable,Pieza,50005985,TRUE
GAL-0067,5986,CROP TOP CON ESTAMPADO FLORAL LILA,,,,CROP,GALITA,431,374,2025-07-06,Inventariable,Pieza,50005986,TRUE
GAL-0068,5987,SHORT CON CUELLO EN V AZUL MARINO,,,,SHORT,GALITA,216,180,2025-07-06,Inventariable,Pieza,50005987,TRUE
GAL-0069,5988,VESTIDO ACANALADO GRIS JASPE,,,,VESTIDO,GALITA,404,351,2025-07-06,Inventariable,Pieza,50005988,TRUE
GAL-0070,5989,PANTALON CON BORDADO SUIZO BURDEOS,,,,PANTALON,GALITA,504,438,2025-07-06,Inventariable,Pieza,50005989,TRUE
AMB-0104,5990,PANTALON AJUSTADO VERDE ESMERALDA,,,,PANTALON,AMBIANCE APPAREL,189,145,2025-07-06,Inventariable,Pieza,50005990,TRUE
AMB-0105,5991,PANTALON AJUSTADO BLANCO,,,,PANTALON,AMBIANCE APPAREL,147,113,2025-07-06,Inventariable,Pieza,50005991,TRUE
AMB-0106,5992,FALDA DE CORTE RECTO TERRACOTA,,,,FALDA,AMBIANCE APPAREL,201,154,2025-07-06,Inventariable,Pieza,50005992,TRUE
AMB-0107,5993,CARDIGAN DE TEJIDO DENIM AZUL MARINO,,,,CARDIGAN,AMBIANCE APPAREL,201,167,2025-07-06,Inventariable,Pieza,50005993,TRUE
AMB-0108,5994,PANTALON DE CORTE RECTO BEIGE,,,,PANTALON,AMBIANCE APPAREL,198,152,2025-07-06,Inventariable,Pieza,50005994,TRUE
AMB-0109,5995,PANTALON CON CUELLO EN V NEGRO,,,,PANTALON,AMBIANCE APPAREL,221,184,2025-07-06,Inventariable,Pieza,50005995,TRUE
AMB-0110,5996,BLUSA OVERSIZE BLANCO,,,,BLUSA,AMBIANCE APPAREL,208,160,2025-07-06,Inventariable,Pieza,50005996,TRUE
LOV-0046,5997,ENTERIZO CON ESTAMPADO FLORAL CREMA,,,,ENTERIZO,LOVE,107,82,2025-07-06,Inventariable,Pieza,50005997,TRUE
LOV-0047,5998,FALDA DE CORTE RECTO GRIS JASPE,,,,FALDA,LOVE,222,185,2025-07-06,Inventariable,Pieza,50005998,TRUE
LOV-0048,5999,BLUSA CON LAZADA VERDE ESMERALDA,,,,BLUSA,LOVE,198,152,2025-07-06,Inventariable,Pieza,50005999,TRUE
LOV-0049,6000,PANTALON DE LINO LILA,,,,PANTALON,LOVE,108,83,2025-07-06,Inventariable,Pieza,50006000,TRUE
LOV-0050,6001,FALDA ACANALADO AZUL CIELO,,,,FALDA,LOVE,197,151,2025-07-06,Inventariable,Pieza,50006001,TRUE
LOV-0051,6002,BLUSA AJUSTADO VERDE ESMERALDA,,,,BLUSA,LOVE,197,151,2025-07-06,Inventariable,Pieza,50006002,TRUE
DAZ-0014,6003,CAMISA CON BOTONES FRONTALES MOSTAZA,,,,CAMISA,DAZZLING,381,317,2025-07-06,Inventariable,Pieza,50006003,TRUE
DAZ-0015,6004,TOP DE TEJIDO DENIM ROSA PASTEL,,,,TOP,DAZZLING,380,316,2025-07-06,Inventariable,Pieza,50006004,TRUE
PAP-0119,6005,PANTALON CON BOTONES FRONTALES CREMA,,,,PANTALON,PAPERMOON,400,347,2025-07-06,Inventariable,Pieza,50006005,TRUE
PAP-0120,6006,PANTALON OVERSIZE BLANCO,,,,PANTALON,PAPERMOON,315,262,2025-07-06,Inventariable,Pieza,50006006,TRUE
PAP-0121,6007,VESTIDO SATINADO CREMA,,,,VESTIDO,PAPERMOON,270,225,2025-07-06,Inventariable,Pieza,50006007,TRUE
PAP-0122,6008,CARDIGAN CON OLANES CREMA,,,,CARDIGAN,PAPERMOON,260,216,2025-07-06,Inventariable,Pieza,50006008,TRUE
PAP-0123,6009,CARDIGAN OVERSIZE BURDEOS,,,,CARDIGAN,PAPERMOON,406,353,2025-07-06,Inventariable,Pieza,50006009,TRUE
PAP-0124,6010,VESTIDO AJUSTADO GRIS JASPE,,,,VESTIDO,PAPERMOON,311,259,2025-07-06,Inventariable,Pieza,50006010,TRUE
PAP-0125,6011,CAMISA AJUSTADO ROSA PASTEL,,,,CAMISA,PAPERMOON,228,190,2025-07-06,Inventariable,Pieza,50006011,TRUE
PAP-0126,6012,BLUSA DE ENCAJE BEIGE,,,,BLUSA,PAPERMOON,347,289,2025-07-06,Inventariable,Pieza,50006012,TRUE
PAP-0127,6013,CAMISA CON BORDADO SUIZO AZUL MARINO,,,,CAMISA,PAPERMOON,375,326,2025-07-06,Inventariable,Pieza,50006013,TRUE
PAP-0128,6014,ENTERIZO PLISADO BEIGE,,,,ENTERIZO,PAPERMOON,401,348,2025-07-06,Inventariable,Pieza,50006014,TRUE
PAP-0129,6015,VESTIDO PLISADO GRIS JASPE,,,,VESTIDO,PAPERMOON,192,147,2025-07-06,Inventariable,Pieza,50006015,TRUE
PAP-0130,6016,SHORT MANGA OBISPO CREMA,,,,SHORT,PAPERMOON,359,299,2025-07-06,Inventariable,Pieza,50006016,TRUE
PAP-0131,6017,PANTALON MANGA OBISPO BURDEOS,,,,PANTALON,PAPERMOON,340,283,2025-07-06,Inventariable,Pieza,50006017,TRUE
PAP-0132,6018,PANTALON CON OLANES AZUL MARINO,,,,PANTALON,PAPERMOON,333,277,2025-07-06,Inventariable,Pieza,50006018,TRUE
MIL-0105,6019,PANTALON CON BORDADO SUIZO CREMA,,,,PANTALON,MILK & HONEY,245,204,2025-07-06,Inventariable,Pieza,50006019,TRUE
MIL-0106,6020,FALDA CON OLANES AZUL CIELO,,,,FALDA,MILK & HONEY,287,239,2025-07-06,Inventariable,Pieza,50006020,TRUE
MIL-0107,6021,CAMISA CON ESTAMPADO FLORAL CREMA,,,,CAMISA,MILK & HONEY,222,185,2025-07-06,Inventariable,Pieza,50006021,TRUE
MIL-0108,6022,TOP ACANALADO MOSTAZA,,,,TOP,MILK & HONEY,252,210,2025-07-06,Inventariable,Pieza,50006022,TRUE
MIL-0109,6023,PANTALON DE ENCAJE AZUL MARINO,,,,PANTALON,MILK & HONEY,239,199,2025-07-06,Inventariable,Pieza,50006023,TRUE
MIL-0110,6024,SHORT CON BOTONES FRONTALES VERDE ESMERALDA,,,,SHORT,MILK & HONEY,243,202,2025-07-06,Inventariable,Pieza,50006024,TRUE
MIL-0111,6025,TOP CON OLANES BLANCO,,,,TOP,MILK & HONEY,284,236,2025-07-06,Inventariable,Pieza,50006025,TRUE
MIL-0112,6026,CAMISA CON OLANES CREMA,,,,CAMISA,MILK & HONEY,268,223,2025-07-06,Inventariable,Pieza,50006026,TRUE
MIL-0113,6027,ENTERIZO SATINADO VERDE ESMERALDA,,,,ENTERIZO,MILK & HONEY,280,233,2025-07-06,Inventariable,Pieza,50006027,TRUE
MIL-0114,6028,SHORT ACANALADO ROSA PASTEL,,,,SHORT,MILK & HONEY,256,213,2025-07-06,Inventariable,Pieza,50006028,TRUE
MIL-0115,6029,BLUSA DE ENCAJE NEGRO,,,,BLUSA,MILK & HONEY,215,179,2025-07-06,Inventariable,Pieza,50006029,TRUE
MIL-0116,6030,CAMISA CON BORDADO SUIZO TERRACOTA,,,,CAMISA,MILK & HONEY,264,220,2025-07-06,Inventariable,Pieza,50006030,TRUE
INA-0019,6031,PANTALON CON BORDADO SUIZO MOSTAZA,,,,PANTALON,INA,344,286,2025-08-04,Inventariable,Pieza,50006031,TRUE
INA-0020,6032,PANTALON MANGA OBISPO VERDE ESMERALDA,,,,PANTALON,INA,338,281,2025-08-04,Inventariable,Pieza,50006032,TRUE
WOR-0022,6033,SHORT CON ESTAMPADO FLORAL NEGRO,,,,SHORT,THE WORK SHOP,220,183,2025-08-04,Inventariable,Pieza,50006033,TRUE
WOR-0023,6034,VESTIDO CON OLANES MOSTAZA,,,,VESTIDO,THE WORK SHOP,220,183,2025-08-04,Inventariable,Pieza,50006034,TRUE
WOR-0024,6035,SHORT ACANALADO LILA,,,,SHORT,THE WORK SHOP,201,167,2025-08-04,Inventariable,Pieza,50006035,TRUE
WOR-0025,6036,CAMISA CON BOTONES FRONTALES CREMA,,,,CAMISA,THE WORK SHOP,220,183,2025-08-04,Inventariable,Pieza,50006036,TRUE
WOR-0026,6037,SHORT MANGA OBISPO AZUL CIELO,,,,SHORT,THE WORK SHOP,236,196,2025-08-04,Inventariable,Pieza,50006037,TRUE
WOR-0027,6038,ENTERIZO CON OLANES MOSTAZA,,,,ENTERIZO,THE WORK SHOP,201,154,2025-08-04,Inventariable,Pieza,50006038,TRUE
WOR-0028,6039,CAMISA DE LINO GRIS JASPE,,,,CAMISA,THE WORK SHOP,207,172,2025-08-04,Inventariable,Pieza,50006039,TRUE
FAS-0051,6040,PANTALON AJUSTADO LILA,,,,PANTALON,FASHION CARGO (PASSPORT),184,141,2025-08-04,Inventariable,Pieza,50006040,TRUE
FAS-0052,6041,TOP AJUSTADO VERDE ESMERALDA,,,,TOP,FASHION CARGO (PASSPORT),195,150,2025-08-04,Inventariable,Pieza,50006041,TRUE
FAS-0053,6042,ENTERIZO CON OLANES AZUL MARINO,,,,ENTERIZO,FASHION CARGO (PASSPORT),186,143,2025-08-04,Inventariable,Pieza,50006042,TRUE
FAS-0054,6043,FALDA DE ENCAJE ROSA PASTEL,,,,FALDA,FASHION CARGO (PASSPORT),180,138,2025-08-04,Inventariable,Pieza,50006043,TRUE
FAS-0055,6044,TOP SATINADO AZUL MARINO,,,,TOP,FASHION CARGO (PASSPORT),184,141,2025-08-04,Inventariable,Pieza,50006044,TRUE
FAS-0056,6045,CARDIGAN OVERSIZE TERRACOTA,,,,CARDIGAN,FASHION CARGO (PASSPORT),180,138,2025-08-04,Inventariable,Pieza,50006045,TRUE
TEE-0088,6046,SHORT SATINADO AZUL MARINO,,,,SHORT,TEENBELL,173,133,2025-08-04,Inventariable,Pieza,50006046,TRUE
TEE-0089,6047,ENTERIZO ACANALADO GRIS JASPE,,,,ENTERIZO,TEENBELL,189,145,2025-08-04,Inventariable,Pieza,50006047,TRUE
TEE-0090,6048,FALDA MANGA OBISPO TERRACOTA,,,,FALDA,TEENBELL,162,124,2025-08-04,Inventariable,Pieza,50006048,TRUE
TEE-0091,6049,TOP DE LINO CREMA,,,,TOP,TEENBELL,151,116,2025-08-04,Inventariable,Pieza,50006049,TRUE
