sku,id_producto,nombre_producto,modelo,color,talla,categoria,marca,precio_venta,costo,fecha,tipo_producto,unidad_medida,codigo_barras,Tipo_producto_afecta_inventario
CRE-0015,1808,CARDIGAN CON BOTONES FRONTALES CREMA,,,,CARDIGAN,CRETA,324,270,2024-06-07,Inventariable,Pieza,50001808,TRUE
CRE-0016,1809,ENTERIZO PLISADO VERDE ESMERALDA,,,,ENTERIZO,CRETA,328,273,2024-06-07,Inventariable,Pieza,50001809,TRUE
BET-0025,1810,ENTERIZO CON OLANES BEIGE,,,,ENTERIZO,BETTER BE,300,250,2024-06-07,Inventariable,Pieza,50001810,TRUE
BET-0026,1811,CROP TOP SATINADO ROSA PASTEL,,,,CROP,BETTER BE,273,227,2024-06-07,Inventariable,Pieza,50001811,TRUE
BET-0027,1812,VESTIDO ACANALADO GRIS JASPE,,,,VESTIDO,BETTER BE,312,260,2024-06-07,Inventariable,Pieza,50001812,TRUE
BET-0028,1813,ENTERIZO AJUSTADO AZUL CIELO,,,,ENTERIZO,BETTER BE,234,195,2024-06-07,Inventariable,Pieza,50001813,TRUE
BET-0029,1814,PANTALON CON BOTONES FRONTALES VERDE ESMERALDA,,,,PANTALON,BETTER BE,248,206,2024-06-07,Inventariable,Pieza,50001814,TRUE
TOS-0045,1815,VESTIDO CON OLANES GRIS JASPE,,,,VESTIDO,TOSKA,327,272,2024-06-07,Inventariable,Pieza,50001815,TRUE
TOS-0046,1816,FALDA DE CORTE RECTO BLANCO,,,,FALDA,TOSKA,354,295,2024-06-07,Inventariable,Pieza,50001816,TRUE
TOS-0047,1817,TOP CON CUELLO EN V BEIGE,,,,TOP,TOSKA,240,200,2024-06-07,Inventariable,Pieza,50001817,TRUE
TOS-0048,1818,ENTERIZO AJUSTADO MOSTAZA,,,,ENTERIZO,TOSKA,356,296,2024-06-07,Inventariable,Pieza,50001818,TRUE
TOS-0049,1819,SHORT DE LINO GRIS JASPE,,,,SHORT,TOSKA,342,285,2024-06-07,Inventariable,Pieza,50001819,TRUE
TOS-0050,1820,ENTERIZO OVERSIZE MOSTAZA,,,,ENTERIZO,TOSKA,310,258,2024-06-07,Inventariable,Pieza,50001820,TRUE
TOS-0051,1821,BLUSA SATINADO BURDEOS,,,,BLUSA,TOSKA,224,186,2024-06-07,Inventariable,Pieza,50001821,TRUE
TOS-0052,1822,TOP DE LINO VERDE ESMERALDA,,,,TOP,TOSKA,348,290,2024-06-07,Inventariable,Pieza,50001822,TRUE
TOS-0053,1823,PANTALON CON LAZADA GRIS JASPE,,,,PANTALON,TOSKA,255,212,2024-06-07,Inventariable,Pieza,50001823,TRUE
TOS-0054,1824,SHORT CON LAZADA BLANCO,,,,SHORT,TOSKA,234,195,2024-06-07,Inventariable,Pieza,50001824,TRUE
TOS-0055,1825,ENTERIZO MANGA OBISPO BLANCO,,,,ENTERIZO,TOSKA,257,214,2024-06-07,Inventariable,Pieza,50001825,TRUE
TOS-0056,1826,FALDA DE CORTE RECTO NEGRO,,,,FALDA,TOSKA,329,274,2024-06-07,Inventariable,Pieza,50001826,TRUE
ACG-0076,1827,TOP MANGA OBISPO BLANCO,,,,TOP,ACG,274,228,2024-06-07,Inventariable,Pieza,50001827,TRUE
ACG-0077,1828,FALDA CON ESTAMPADO FLORAL BEIGE,,,,FALDA,ACG,203,156,2024-06-07,Inventariable,Pieza,50001828,TRUE
ACG-0078,1829,FALDA CON CUELLO EN V MOSTAZA,,,,FALDA,ACG,300,250,2024-06-07,Inventariable,Pieza,50001829,TRUE
ACG-0079,1830,PANTALON AJUSTADO AZUL MARINO,,,,PANTALON,ACG,252,210,2024-06-07,Inventariable,Pieza,50001830,TRUE
ACG-0080,1831,CAMISA DE ENCAJE BURDEOS,,,,CAMISA,ACG,225,187,2024-06-07,Inventariable,Pieza,50001831,TRUE
ACG-0081,1832,CARDIGAN CON CUELLO EN V CREMA,,,,CARDIGAN,ACG,243,202,2024-06-07,Inventariable,Pieza,50001832,TRUE
ACG-0082,1833,ENTERIZO DE LINO AZUL CIELO,,,,ENTERIZO,ACG,300,250,2024-06-07,Inventariable,Pieza,50001833,TRUE
ACG-0083,1834,VESTIDO SATINADO TERRACOTA,,,,VESTIDO,ACG,198,152,2024-06-07,Inventariable,Pieza,50001834,TRUE
ACG-0084,1835,CROP TOP PLISADO BLANCO,,,,CROP,ACG,302,251,2024-06-07,Inventariable,Pieza,50001835,TRUE
ACG-0085,1836,CARDIGAN PLISADO TERRACOTA,,,,CARDIGAN,ACG,201,167,2024-06-07,Inventariable,Pieza,50001836,TRUE
ACG-0086,1837,VESTIDO ACANALADO TERRACOTA,,,,VESTIDO,ACG,297,247,2024-06-07,Inventariable,Pieza,50001837,TRUE
ACG-0087,1838,CAMISA CON CUELLO EN V GRIS JASPE,,,,CAMISA,ACG,251,209,2024-06-07,Inventariable,Pieza,50001838,TRUE
HYF-0049,1839,ENTERIZO AJUSTADO AZUL MARINO,,,,ENTERIZO,HYFVE,208,173,2024-06-07,Inventariable,Pieza,50001839,TRUE
HYF-0050,1840,TOP PLISADO LILA,,,,TOP,HYFVE,386,321,2024-06-07,Inventariable,Pieza,50001840,TRUE
HYF-0051,1841,CAMISA DE LINO LILA,,,,CAMISA,HYFVE,396,344,2024-06-07,Inventariable,Pieza,50001841,TRUE
HYF-0052,1842,SHORT CON ESTAMPADO FLORAL VERDE ESMERALDA,,,,SHORT,HYFVE,440,382,2024-06-07,Inventariable,Pieza,50001842,TRUE
HYF-0053,1843,FALDA DE TEJIDO DENIM VERDE ESMERALDA,,,,FALDA,HYFVE,228,190,2024-06-07,Inventariable,Pieza,50001843,TRUE
HYF-0054,1844,PANTALON CON OLANES BURDEOS,,,,PANTALON,HYFVE,413,359,2024-06-07,Inventariable,Pieza,50001844,TRUE
GEE-0018,1845,SHORT DE LINO AZUL MARINO,,,,SHORT,GEEGEE,318,265,2024-06-07,Inventariable,Pieza,50001845,TRUE
GEE-0019,1846,CAMISA DE ENCAJE AZUL CIELO,,,,CAMISA,GEEGEE,318,265,2024-06-07,Inventariable,Pieza,50001846,TRUE
AMB-0081,1847,TOP CON CUELLO EN V CREMA,,,,TOP,AMBIANCE APPAREL,179,137,2024-06-07,Inventariable,Pieza,50001847,TRUE
AMB-0082,1848,FALDA CON OLANES MOSTAZA,,,,FALDA,AMBIANCE APPAREL,211,162,2024-06-07,Inventariable,Pieza,50001848,TRUE
AMB-0083,1849,PANTALON PLISADO BLANCO,,,,PANTALON,AMBIANCE APPAREL,154,118,2024-06-07,Inventariable,Pieza,50001849,TRUE
AMB-0084,1850,CARDIGAN AJUSTADO AZUL CIELO,,,,CARDIGAN,AMBIANCE APPAREL,108,83,2024-06-07,Inventariable,Pieza,50001850,TRUE
AMB-0085,1851,BLUSA CON ESTAMPADO FLORAL NEGRO,,,,BLUSA,AMBIANCE APPAREL,149,114,2024-06-07,Inventariable,Pieza,50001851,TRUE
AMB-0086,1852,CAMISA CON BORDADO SUIZO BLANCO,,,,CAMISA,AMBIANCE APPAREL,231,192,2024-06-07,Inventariable,Pieza,50001852,TRUE
AMB-0087,1853,PANTALON CON LAZADA AZUL MARINO,,,,PANTALON,AMBIANCE APPAREL,129,99,2024-06-07,Inventariable,Pieza,50001853,TRUE
AMB-0088,1854,TOP CON ESTAMPADO FLORAL NEGRO,,,,TOP,AMBIANCE APPAREL,177,136,2024-06-07,Inventariable,Pieza,50001854,TRUE
AMB-0089,1855,CAMISA ACANALADO ROSA PASTEL,,,,CAMISA,AMBIANCE APPAREL,177,136,2024-06-07,Inventariable,Pieza,50001855,TRUE
AMB-0090,1856,SHORT PLISADO BEIGE,,,,SHORT,AMBIANCE APPAREL,201,154,2024-06-07,Inventariable,Pieza,50001856,TRUE
AMB-0091,1857,BLUSA OVERSIZE NEGRO,,,,BLUSA,AMBIANCE APPAREL,119,91,2024-06-07,Inventariable,Pieza,50001857,TRUE
AMB-0092,1858,CROP TOP DE LINO TERRACOTA,,,,CROP,AMBIANCE APPAREL,211,162,2024-06-07,Inventariable,Pieza,50001858,TRUE
AMB-0093,1859,BLUSA MANGA OBISPO LILA,,,,BLUSA,AMBIANCE APPAREL,95,73,2024-06-07,Inventariable,Pieza,50001859,TRUE
ONE-0033,1860,VESTIDO SATINADO ROSA PASTEL,,,,VESTIDO,ONE N MORE,458,398,2024-06-07,Inventariable,Pieza,50001860,TRUE
ONE-0034,1861,VESTIDO OVERSIZE AZUL CIELO,,,,VESTIDO,ONE N MORE,542,471,2024-06-07,Inventariable,Pieza,50001861,TRUE
ONE-0035,1862,TOP SATINADO GRIS JASPE,,,,TOP,ONE N MORE,447,388,2024-06-07,Inventariable,Pieza,50001862,TRUE
ONE-0036,1863,VESTIDO DE CORTE RECTO BLANCO,,,,VESTIDO,ONE N MORE,631,548,2024-06-07,Inventariable,Pieza,50001863,TRUE
CIS-0012,1864,CAMISA DE CORTE RECTO LILA,,,,CAMISA,CI SONO CORDUROY,261,217,2024-06-08,Inventariable,Pieza,50001864,TRUE
CIS-0013,1865,ENTERIZO CON OLANES NEGRO,,,,ENTERIZO,CI SONO CORDUROY,261,217,2024-06-08,Inventariable,Pieza,50001865,TRUE
MIN-0115,1866,CROP TOP CON BORDADO SUIZO TERRACOTA,,,,CROP,MINE,125,96,2024-06-08,Inventariable,Pieza,50001866,TRUE
MIN-0116,1867,CAMISA OVERSIZE BURDEOS,,,,CAMISA,MINE,158,121,2024-06-08,Inventariable,Pieza,50001867,TRUE
MIN-0117,1868,ENTERIZO CON BORDADO SUIZO AZUL MARINO,,,,ENTERIZO,MINE,123,94,2024-06-08,Inventariable,Pieza,50001868,TRUE
MIN-0118,1869,SHORT CON CUELLO EN V CREMA,,,,SHORT,MINE,214,178,2024-06-08,Inventariable,Pieza,50001869,TRUE
MIN-0119,1870,CARDIGAN MANGA OBISPO BURDEOS,,,,CARDIGAN,MINE,153,117,2024-06-08,Inventariable,Pieza,50001870,TRUE
MIN-0120,1871,CROP TOP SATINADO MOSTAZA,,,,CROP,MINE,228,190,2024-06-08,Inventariable,Pieza,50001871,TRUE
MIN-0121,1872,VESTIDO CON OLANES BLANCO,,,,VESTIDO,MINE,194,149,2024-06-08,Inventariable,Pieza,50001872,TRUE
LOP-0062,1873,CROP TOP CON LAZADA NEGRO,,,,CROP,LOVE POEM,336,280,2024-06-08,Inventariable,Pieza,50001873,TRUE
LOP-0063,1874,TOP SATINADO BEIGE,,,,TOP,LOVE POEM,124,95,2024-06-08,Inventariable,Pieza,50001874,TRUE
LOP-0064,1875,CROP TOP DE ENCAJE BEIGE,,,,CROP,LOVE POEM,260,216,2024-06-08,Inventariable,Pieza,50001875,TRUE
LOP-0065,1876,ENTERIZO AJUSTADO BLANCO,,,,ENTERIZO,LOVE POEM,215,165,2024-06-08,Inventariable,Pieza,50001876,TRUE
LOP-0066,1877,BLUSA MANGA OBISPO BURDEOS,,,,BLUSA,LOVE POEM,154,118,2024-06-08,Inventariable,Pieza,50001877,TRUE
LOP-0067,1878,TOP CON ESTAMPADO FLORAL TERRACOTA,,,,TOP,LOVE POEM,339,282,2024-06-08,Inventariable,Pieza,50001878,TRUE
LOP-0068,1879,CARDIGAN ACANALADO LILA,,,,CARDIGAN,LOVE POEM,134,103,2024-06-08,Inventariable,Pieza,50001879,TRUE
LOP-0069,1880,FALDA SATINADO MOSTAZA,,,,FALDA,LOVE POEM,333,277,2024-06-08,Inventariable,Pieza,50001880,TRUE
AJL-0041,1881,VESTIDO CON ESTAMPADO FLORAL CREMA,,,,VESTIDO,AJ LEE APPAREL,212,176,2024-06-08,Inventariable,Pieza,50001881,TRUE
AJL-0042,1882,ENTERIZO CON CUELLO EN V ROSA PASTEL,,,,ENTERIZO,AJ LEE APPAREL,203,169,2024-06-08,Inventariable,Pieza,50001882,TRUE
AJL-0043,1883,SHORT PLISADO BLANCO,,,,SHORT,AJ LEE APPAREL,204,170,2024-06-08,Inventariable,Pieza,50001883,TRUE
AJL-0044,1884,SHORT CON ESTAMPADO FLORAL LILA,,,,SHORT,AJ LEE APPAREL,219,182,2024-06-08,Inventariable,Pieza,50001884,TRUE
AJL-0045,1885,CARDIGAN DE CORTE RECTO CREMA,,,,CARDIGAN,AJ LEE APPAREL,219,182,2024-06-08,Inventariable,Pieza,50001885,TRUE
AJL-0046,1886,PANTALON ACANALADO GRIS JASPE,,,,PANTALON,AJ LEE APPAREL,215,165,2024-06-08,Inventariable,Pieza,50001886,TRUE
VER-0016,1887,VESTIDO MANGA OBISPO BLANCO,,,,VESTIDO,VERYJ,294,245,2024-06-08,Inventariable,Pieza,50001887,TRUE
VER-0017,1888,CAMISA DE LINO VERDE ESMERALDA,,,,CAMISA,VERYJ,296,246,2024-06-08,Inventariable,Pieza,50001888,TRUE
NEW-0070,1889,FALDA OVERSIZE BEIGE,,,,FALDA,NEW IN,222,185,2024-06-08,Inventariable,Pieza,50001889,TRUE
NEW-0071,1890,PANTALON DE CORTE RECTO GRIS JASPE,,,,PANTALON,NEW IN,239,199,2024-06-08,Inventariable,Pieza,50001890,TRUE
NEW-0072,1891,CROP TOP DE ENCAJE TERRACOTA,,,,CROP,NEW IN,324,270,2024-06-08,Inventariable,Pieza,50001891,TRUE
NEW-0073,1892,VESTIDO DE CORTE RECTO VERDE ESMERALDA,,,,VESTIDO,NEW IN,264,220,2024-06-08,Inventariable,Pieza,50001892,TRUE
NEW-0074,1893,SHORT CON ESTAMPADO FLORAL BLANCO,,,,SHORT,NEW IN,246,205,2024-06-08,Inventariable,Pieza,50001893,TRUE
NEW-0075,1894,VESTIDO DE CORTE RECTO BEIGE,,,,VESTIDO,NEW IN,323,269,2024-06-08,Inventariable,Pieza,50001894,TRUE
TAB-0034,1895,SHORT CON OLANES MOSTAZA,,,,SHORT,TABA,185,142,2024-06-08,Inventariable,Pieza,50001895,TRUE
TAB-0035,1896,PANTALON DE ENCAJE BEIGE,,,,PANTALON,TABA,163,125,2024-06-08,Inventariable,Pieza,50001896,TRUE
TAB-0036,1897,CARDIGAN OVERSIZE ROSA PASTEL,,,,CARDIGAN,TABA,193,148,2024-06-08,Inventariable,Pieza,50001897,TRUE
TAB-0037,1898,PANTALON DE LINO VERDE ESMERALDA,,,,PANTALON,TABA,182,140,2024-06-08,Inventariable,Pieza,50001898,TRUE
TAB-0038,1899,CAMISA CON LAZADA BEIGE,,,,CAMISA,TABA,188,144,2024-06-08,Inventariable,Pieza,50001899,TRUE
TAB-0039,1900,CAMISA MANGA OBISPO AZUL MARINO,,,,CAMISA,TABA,167,128,2024-06-08,Inventariable,Pieza,50001900,TRUE
TAB-0040,1901,SHORT DE CORTE RECTO GRIS JASPE,,,,SHORT,TABA,167,128,2024-06-08,Inventariable,Pieza,50001901,TRUE
TAB-0041,1902,BLUSA SATINADO BLANCO,,,,BLUSA,TABA,166,127,2024-06-08,Inventariable,Pieza,50001902,TRUE
TIM-0021,1903,TOP CON ESTAMPADO FLORAL MOSTAZA,,,,TOP,TIMING,308,256,2024-06-08,Inventariable,Pieza,50001903,TRUE
TIM-0022,1904,BLUSA SATINADO AZUL CIELO,,,,BLUSA,TIMING,328,273,2024-06-08,Inventariable,Pieza,50001904,TRUE
TIM-0023,1905,SHORT DE LINO BLANCO,,,,SHORT,TIMING,195,150,2024-06-08,Inventariable,Pieza,50001905,TRUE
TIM-0024,1906,BLUSA CON BOTONES FRONTALES LILA,,,,BLUSA,TIMING,222,185,2024-06-08,Inventariable,Pieza,50001906,TRUE
TIM-0025,1907,VESTIDO CON ESTAMPADO FLORAL CREMA,,,,VESTIDO,TIMING,286,238,2024-06-08,Inventariable,Pieza,50001907,TRUE
TIM-0026,1908,CROP TOP DE ENCAJE GRIS JASPE,,,,CROP,TIMING,119,91,2024-06-08,Inventariable,Pieza,50001908,TRUE
DAZ-0010,1909,BLUSA CON ESTAMPADO FLORAL LILA,,,,BLUSA,DAZZLING,380,316,2024-06-08,Inventariable,Pieza,50001909,TRUE
DAZ-0011,1910,BLUSA DE TEJIDO DENIM VERDE ESMERALDA,,,,BLUSA,DAZZLING,379,329,2024-06-08,Inventariable,Pieza,50001910,TRUE
INA-0013,1911,FALDA CON CUELLO EN V ROSA PASTEL,,,,FALDA,INA,344,286,2024-06-08,Inventariable,Pieza,50001911,TRUE
INA-0014,1912,ENTERIZO DE LINO VERDE ESMERALDA,,,,ENTERIZO,INA,342,285,2024-06-08,Inventariable,Pieza,50001912,TRUE
IN2-0028,1913,TOP ACANALADO TERRACOTA,,,,TOP,IN 2 YOU,202,155,2024-06-08,Inventariable,Pieza,50001913,TRUE
IN2-0029,1914,ENTERIZO DE ENCAJE ROSA PASTEL,,,,ENTERIZO,IN 2 YOU,208,160,2024-06-08,Inventariable,Pieza,50001914,TRUE
IN2-0030,1915,SHORT DE TEJIDO DENIM ROSA PASTEL,,,,SHORT,IN 2 YOU,201,154,2024-06-08,Inventariable,Pieza,50001915,TRUE
IN2-0031,1916,CAMISA SATINADO CREMA,,,,CAMISA,IN 2 YOU,202,155,2024-06-08,Inventariable,Pieza,50001916,TRUE
EDI-0043,1917,VESTIDO DE CORTE RECTO GRIS JASPE,,,,VESTIDO,EDIT BY NINE,443,385,2024-07-04,Inventariable,Pieza,50001917,TRUE
EDI-0044,1918,BLUSA SATINADO MOSTAZA,,,,BLUSA,EDIT BY NINE,396,344,2024-07-04,Inventariable,Pieza,50001918,TRUE
EDI-0045,1919,BLUSA DE LINO GRIS JASPE,,,,BLUSA,EDIT BY NINE,516,448,2024-07-04,Inventariable,Pieza,50001919,TRUE
EDI-0046,1920,CROP TOP CON LAZADA BEIGE,,,,CROP,EDIT BY NINE,335,279,2024-07-04,Inventariable,Pieza,50001920,TRUE
EDI-0047,1921,ENTERIZO DE TEJIDO DENIM BLANCO,,,,ENTERIZO,EDIT BY NINE,515,447,2024-07-04,Inventariable,Pieza,50001921,TRUE
EDI-0048,1922,CARDIGAN PLISADO LILA,,,,CARDIGAN,EDIT BY NINE,264,220,2024-07-04,Inventariable,Pieza,50001922,TRUE
EDI-0049,1923,BLUSA CON ESTAMPADO FLORAL MOSTAZA,,,,BLUSA,EDIT BY NINE,462,401,2024-07-04,Inventariable,Pieza,50001923,TRUE
EDI-0050,1924,CROP TOP AJUSTADO NEGRO,,,,CROP,EDIT BY NINE,452,393,2024-07-04,Inventariable,Pieza,50001924,TRUE
RUN-0033,1925,CROP TOP DE LINO AZUL CIELO,,,,CROP,RUNWAYPARIS,254,211,2024-07-04,Inventariable,Pieza,50001925,TRUE
RUN-0034,1926,BLUSA DE CORTE RECTO AZUL MARINO,,,,BLUSA,RUNWAYPARIS,194,149,2024-07-04,Inventariable,Pieza,50001926,TRUE
RUN-0035,1927,CROP TOP ACANALADO NEGRO,,,,CROP,RUNWAYPARIS,198,152,2024-07-04,Inventariable,Pieza,50001927,TRUE
RUN-0036,1928,VESTIDO DE LINO CREMA,,,,VESTIDO,RUNWAYPARIS,212,176,2024-07-04,Inventariable,Pieza,50001928,TRUE
RUN-0037,1929,FALDA PLISADO LILA,,,,FALDA,RUNWAYPARIS,208,173,2024-07-04,Inventariable,Pieza,50001929,TRUE
RUN-0038,1930,BLUSA CON ESTAMPADO FLORAL VERDE ESMERALDA,,,,BLUSA,RUNWAYPARIS,220,183,2024-07-04,Inventariable,Pieza,50001930,TRUE
RUN-0039,1931,CAMISA DE ENCAJE GRIS JASPE,,,,CAMISA,RUNWAYPARIS,314,261,2024-07-04,Inventariable,Pieza,50001931,TRUE
MIC-0165,1932,SHORT PLISADO LILA,,,,SHORT,MICHEL,145,111,2024-07-04,Inventariable,Pieza,50001932,TRUE
MIC-0166,1933,CAMISA SATINADO ROSA PASTEL,,,,CAMISA,MICHEL,155,119,2024-07-04,Inventariable,Pieza,50001933,TRUE
MIC-0167,1934,VESTIDO SATINADO BEIGE,,,,VESTIDO,MICHEL,162,124,2024-07-04,Inventariable,Pieza,50001934,TRUE
MIC-0168,1935,CARDIGAN AJUSTADO MOSTAZA,,,,CARDIGAN,MICHEL,179,137,2024-07-04,Inventariable,Pieza,50001935,TRUE
MIC-0169,1936,TOP CON BORDADO SUIZO GRIS JASPE,,,,TOP,MICHEL,125,96,2024-07-04,Inventariable,Pieza,50001936,TRUE
MIC-0170,1937,PANTALON DE LINO AZUL MARINO,,,,PANTALON,MICHEL,119,91,2024-07-04,Inventariable,Pieza,50001937,TRUE
MIC-0171,1938,SHORT CON OLANES NEGRO,,,,SHORT,MICHEL,244,203,2024-07-04,Inventariable,Pieza,50001938,TRUE
MIC-0172,1939,FALDA ACANALADO CREMA,,,,FALDA,MICHEL,133,102,2024-07-04,Inventariable,Pieza,50001939,TRUE
MIC-0173,1940,PANTALON CON CUELLO EN V BLANCO,,,,PANTALON,MICHEL,138,106,2024-07-04,Inventariable,Pieza,50001940,TRUE
MIC-0174,1941,FALDA CON CUELLO EN V BURDEOS,,,,FALDA,MICHEL,164,126,2024-07-04,Inventariable,Pieza,50001941,TRUE
MIC-0175,1942,PANTALON AJUSTADO BLANCO,,,,PANTALON,MICHEL,212,163,2024-07-04,Inventariable,Pieza,50001942,TRUE
MIC-0176,1943,VESTIDO AJUSTADO AZUL CIELO,,,,VESTIDO,MICHEL,166,127,2024-07-04,Inventariable,Pieza,50001943,TRUE
MIC-0177,1944,CARDIGAN SATINADO NEGRO,,,,CARDIGAN,MICHEL,189,145,2024-07-04,Inventariable,Pieza,50001944,TRUE
MIC-0178,1945,VESTIDO DE ENCAJE BEIGE,,,,VESTIDO,MICHEL,127,97,2024-07-04,Inventariable,Pieza,50001945,TRUE
IJO-0045,1946,BLUSA CON LAZADA BLANCO,,,,BLUSA,IJOAH,267,222,2024-07-04,Inventariable,Pieza,50001946,TRUE
IJO-0046,1947,CARDIGAN CON LAZADA AZUL CIELO,,,,CARDIGAN,IJOAH,273,227,2024-07-04,Inventariable,Pieza,50001947,TRUE
IJO-0047,1948,CARDIGAN DE CORTE RECTO LILA,,,,CARDIGAN,IJOAH,263,219,2024-07-04,Inventariable,Pieza,50001948,TRUE
IJO-0048,1949,CARDIGAN AJUSTADO AZUL MARINO,,,,CARDIGAN,IJOAH,293,244,2024-07-04,Inventariable,Pieza,50001949,TRUE
IJO-0049,1950,CARDIGAN CON ESTAMPADO FLORAL VERDE ESMERALDA,,,,CARDIGAN,IJOAH,201,167,2024-07-04,Inventariable,Pieza,50001950,TRUE
IJO-0050,1951,FALDA MANGA OBISPO AZUL CIELO,,,,FALDA,IJOAH,245,204,2024-07-04,Inventariable,Pieza,50001951,TRUE
IJO-0051,1952,CROP TOP CON OLANES CREMA,,,,CROP,IJOAH,230,191,2024-07-04,Inventariable,Pieza,50001952,TRUE
IJO-0052,1953,CROP TOP CON OLANES BEIGE,,,,CROP,IJOAH,315,262,2024-07-04,Inventariable,Pieza,50001953,TRUE
IJO-0053,1954,VESTIDO AJUSTADO CREMA,,,,VESTIDO,IJOAH,360,300,2024-07-04,Inventariable,Pieza,50001954,TRUE
IJO-0054,1955,ENTERIZO CON BOTONES FRONTALES VERDE ESMERALDA,,,,ENTERIZO,IJOAH,184,141,2024-07-04,Inventariable,Pieza,50001955,TRUE
IJO-0055,1956,CAMISA PLISADO GRIS JASPE,,,,CAMISA,IJOAH,190,146,2024-07-04,Inventariable,Pieza,50001956,TRUE
IJO-0056,1957,TOP CON CUELLO EN V BLANCO,,,,TOP,IJOAH,362,301,2024-07-04,Inventariable,Pieza,50001957,TRUE
IJO-0057,1958,CARDIGAN CON ESTAMPADO FLORAL TERRACOTA,,,,CARDIGAN,IJOAH,226,188,2024-07-04,Inventariable,Pieza,50001958,TRUE
LEE-0062,1959,ENTERIZO DE ENCAJE GRIS JASPE,,,,ENTERIZO,LEENA,233,194,2024-07-04,Inventariable,Pieza,50001959,TRUE
LEE-0063,1960,TOP PLISADO CREMA,,,,TOP,LEENA,228,190,2024-07-04,Inventariable,Pieza,50001960,TRUE
LEE-0064,1961,VESTIDO DE TEJIDO DENIM VERDE ESMERALDA,,,,VESTIDO,LEENA,534,464,2024-07-04,Inventariable,Pieza,50001961,TRUE
LEE-0065,1962,TOP CON ESTAMPADO FLORAL TERRACOTA,,,,TOP,LEENA,323,269,2024-07-04,Inventariable,Pieza,50001962,TRUE
LEE-0066,1963,ENTERIZO PLISADO NEGRO,,,,ENTERIZO,LEENA,269,224,2024-07-04,Inventariable,Pieza,50001963,TRUE
LEE-0067,1964,FALDA DE CORTE RECTO VERDE ESMERALDA,,,,FALDA,LEENA,478,415,2024-07-04,Inventariable,Pieza,50001964,TRUE
LEE-0068,1965,CAMISA AJUSTADO ROSA PASTEL,,,,CAMISA,LEENA,459,399,2024-07-04,Inventariable,Pieza,50001965,TRUE
LEE-0069,1966,CROP TOP DE ENCAJE BEIGE,,,,CROP,LEENA,578,502,2024-07-04,Inventariable,Pieza,50001966,TRUE
LEE-0070,1967,CAMISA DE CORTE RECTO ROSA PASTEL,,,,CAMISA,LEENA,561,487,2024-07-04,Inventariable,Pieza,50001967,TRUE
LEE-0071,1968,CARDIGAN CON BOTONES FRONTALES ROSA PASTEL,,,,CARDIGAN,LEENA,428,372,2024-07-04,Inventariable,Pieza,50001968,TRUE
LEE-0072,1969,CROP TOP MANGA OBISPO CREMA,,,,CROP,LEENA,472,410,2024-07-04,Inventariable,Pieza,50001969,TRUE
LEE-0073,1970,SHORT CON CUELLO EN V GRIS JASPE,,,,SHORT,LEENA,574,499,2024-07-04,Inventariable,Pieza,50001970,TRUE
LEE-0074,1971,CROP TOP PLISADO NEGRO,,,,CROP,LEENA,248,206,2024-07-04,Inventariable,Pieza,50001971,TRUE
MIA-0030,1972,CROP TOP ACANALADO AZUL CIELO,,,,CROP,MIASMIAS,219,182,2024-07-04,Inventariable,Pieza,50001972,TRUE
MIA-0031,1973,CAMISA CON ESTAMPADO FLORAL BLANCO,,,,CAMISA,MIASMIAS,219,182,2024-07-04,Inventariable,Pieza,50001973,TRUE
MIA-0032,1974,VESTIDO ACANALADO BEIGE,,,,VESTIDO,MIASMIAS,219,182,2024-07-04,Inventariable,Pieza,50001974,TRUE
RIV-0010,1975,CAMISA MANGA OBISPO CREMA,,,,CAMISA,RIVIR,496,431,2024-07-04,Inventariable,Pieza,50001975,TRUE
RIV-0011,1976,TOP OVERSIZE AZUL MARINO,,,,TOP,RIVIR,458,398,2024-07-04,Inventariable,Pieza,50001976,TRUE
HYF-0063,1977,CROP TOP SATINADO BLANCO,,,,CROP,HYFVE,214,164,2024-07-04,Inventariable,Pieza,50001977,TRUE
HYF-0064,1978,ENTERIZO PLISADO BEIGE,,,,ENTERIZO,HYFVE,298,248,2024-07-04,Inventariable,Pieza,50001978,TRUE
HYF-0065,1979,ENTERIZO DE ENCAJE VERDE ESMERALDA,,,,ENTERIZO,HYFVE,292,243,2024-07-04,Inventariable,Pieza,50001979,TRUE
HYF-0066,1980,CROP TOP CON ESTAMPADO FLORAL GRIS JASPE,,,,CROP,HYFVE,230,191,2024-07-04,Inventariable,Pieza,50001980,TRUE
HYF-0067,1981,CAMISA DE TEJIDO DENIM LILA,,,,CAMISA,HYFVE,327,272,2024-07-04,Inventariable,Pieza,50001981,TRUE
HYF-0068,1982,VESTIDO MANGA OBISPO NEGRO,,,,VESTIDO,HYFVE,402,349,2024-07-04,Inventariable,Pieza,50001982,TRUE
ACT-0172,1983,FALDA CON BORDADO SUIZO LILA,,,,FALDA,ACTIVE USA,326,271,2024-07-04,Inventariable,Pieza,50001983,TRUE
ACT-0173,1984,BLUSA AJUSTADO AZUL CIELO,,,,BLUSA,ACTIVE USA,244,203,2024-07-04,Inventariable,Pieza,50001984,TRUE
ACT-0174,1985,VESTIDO CON BOTONES FRONTALES VERDE ESMERALDA,,,,VESTIDO,ACTIVE USA,370,308,2024-07-04,Inventariable,Pieza,50001985,TRUE
ACT-0175,1986,VESTIDO CON BORDADO SUIZO BURDEOS,,,,VESTIDO,ACTIVE USA,130,100,2024-07-04,Inventariable,Pieza,50001986,TRUE
ACT-0176,1987,TOP SATINADO BLANCO,,,,TOP,ACTIVE USA,107,82,2024-07-04,Inventariable,Pieza,50001987,TRUE
ACT-0177,1988,PANTALON SATINADO NEGRO,,,,PANTALON,ACTIVE USA,288,240,2024-07-04,Inventariable,Pieza,50001988,TRUE
ACT-0178,1989,FALDA CON LAZADA GRIS JASPE,,,,FALDA,ACTIVE USA,294,245,2024-07-04,Inventariable,Pieza,50001989,TRUE
ACT-0179,1990,BLUSA PLISADO NEGRO,,,,BLUSA,ACTIVE USA,346,288,2024-07-04,Inventariable,Pieza,50001990,TRUE
ACT-0180,1991,CROP TOP OVERSIZE GRIS JASPE,,,,CROP,ACTIVE USA,149,114,2024-07-04,Inventariable,Pieza,50001991,TRUE
ACT-0181,1992,CARDIGAN DE CORTE RECTO ROSA PASTEL,,,,CARDIGAN,ACTIVE USA,304,253,2024-07-04,Inventariable,Pieza,50001992,TRUE
ACT-0182,1993,TOP MANGA OBISPO LILA,,,,TOP,ACTIVE USA,88,67,2024-07-04,Inventariable,Pieza,50001993,TRUE
ACT-0183,1994,CROP TOP CON LAZADA VERDE ESMERALDA,,,,CROP,ACTIVE USA,255,212,2024-07-04,Inventariable,Pieza,50001994,TRUE
ACT-0184,1995,CAMISA MANGA OBISPO AZUL MARINO,,,,CAMISA,ACTIVE USA,128,98,2024-07-04,Inventariable,Pieza,50001995,TRUE
ACT-0185,1996,TOP MANGA OBISPO BURDEOS,,,,TOP,ACTIVE USA,302,251,2024-07-04,Inventariable,Pieza,50001996,TRUE
MIN-0130,1997,CROP TOP CON OLANES GRIS JASPE,,,,CROP,MINE,315,262,2024-07-04,Inventariable,Pieza,50001997,TRUE
MIN-0131,1998,VESTIDO CON LAZADA AZUL CIELO,,,,VESTIDO,MINE,151,116,2024-07-04,Inventariable,Pieza,50001998,TRUE
MIN-0132,1999,SHORT DE CORTE RECTO BEIGE,,,,SHORT,MINE,257,214,2024-07-04,Inventariable,Pieza,50001999,TRUE
MIN-0133,2000,ENTERIZO DE ENCAJE LILA,,,,ENTERIZO,MINE,242,201,2024-07-04,Inventariable,Pieza,50002000,TRUE
MIN-0134,2001,SHORT AJUSTADO TERRACOTA,,,,SHORT,MINE,143,110,2024-07-04,Inventariable,Pieza,50002001,TRUE
MIN-0135,2002,PANTALON CON LAZADA CREMA,,,,PANTALON,MINE,128,98,2024-07-04,Inventariable,Pieza,50002002,TRUE
MIN-0136,2003,ENTERIZO DE ENCAJE LILA,,,,ENTERIZO,MINE,156,120,2024-07-04,Inventariable,Pieza,50002003,TRUE
MIN-0137,2004,FALDA DE TEJIDO DENIM AZUL MARINO,,,,FALDA,MINE,290,241,2024-07-04,Inventariable,Pieza,50002004,TRUE
MIN-0138,2005,BLUSA CON OLANES BURDEOS,,,,BLUSA,MINE,194,149,2024-07-04,Inventariable,Pieza,50002005,TRUE
MIN-0139,2006,VESTIDO AJUSTADO BEIGE,,,,VESTIDO,MINE,198,152,2024-07-04,Inventariable,Pieza,50002006,TRUE
MIN-0140,2007,BLUSA PLISADO GRIS JASPE,,,,BLUSA,MINE,125,96,2024-07-04,Inventariable,Pieza,50002007,TRUE
MIN-0141,2008,CARDIGAN CON BOTONES FRONTALES NEGRO,,,,CARDIGAN,MINE,309,257,2024-07-04,Inventariable,Pieza,50002008,TRUE
MIN-0142,2009,CAMISA CON ESTAMPADO FLORAL MOSTAZA,,,,CAMISA,MINE,218,181,2024-07-04,Inventariable,Pieza,50002009,TRUE
MIN-0143,2010,CARDIGAN DE LINO MOSTAZA,,,,CARDIGAN,MINE,198,152,2024-07-04,Inventariable,Pieza,50002010,TRUE
MIN-0144,2011,BLUSA CON LAZADA BURDEOS,,,,BLUSA,MINE,222,185,2024-07-04,Inventariable,Pieza,50002011,TRUE
MIN-0145,2012,BLUSA AJUSTADO LILA,,,,BLUSA,MINE,296,246,2024-07-04,Inventariable,Pieza,50002012,TRUE
SOR-0008,2013,SHORT OVERSIZE NEGRO,,,,SHORT,SORRENTO,237,197,2024-07-04,Inventariable,Pieza,50002013,TRUE
SOR-0009,2014,SHORT CON ESTAMPADO FLORAL TERRACOTA,,,,SHORT,SORRENTO,237,197,2024-07-04,Inventariable,Pieza,50002014,TRUE
AMB-0094,2015,ENTERIZO OVERSIZE TERRACOTA,,,,ENTERIZO,AMBIANCE APPAREL,207,159,2024-07-04,Inventariable,Pieza,50002015,TRUE
AMB-0095,2016,SHORT CON OLANES BLANCO,,,,SHORT,AMBIANCE APPAREL,182,140,2024-07-04,Inventariable,Pieza,50002016,TRUE
AMB-0096,2017,CARDIGAN MANGA OBISPO CREMA,,,,CARDIGAN,AMBIANCE APPAREL,150,115,2024-07-04,Inventariable,Pieza,50002017,TRUE
AMB-0097,2018,FALDA CON BOTONES FRONTALES BURDEOS,,,,FALDA,AMBIANCE APPAREL,97,74,2024-07-04,Inventariable,Pieza,50002018,TRUE
AMB-0098,2019,SHORT SATINADO AZUL CIELO,,,,SHORT,AMBIANCE APPAREL,198,152,2024-07-04,Inventariable,Pieza,50002019,TRUE
AMB-0099,2020,TOP CON OLANES GRIS JASPE,,,,TOP,AMBIANCE APPAREL,143,110,2024-07-04,Inventariable,Pieza,50002020,TRUE
AMB-0100,2021,PANTALON PLISADO BURDEOS,,,,PANTALON,AMBIANCE APPAREL,97,74,2024-07-04,Inventariable,Pieza,50002021,TRUE
AMB-0101,2022,CAMISA OVERSIZE ROSA PASTEL,,,,CAMISA,AMBIANCE APPAREL,97,74,2024-07-04,Inventariable,Pieza,50002022,TRUE
AMB-0102,2023,VESTIDO ACANALADO LILA,,,,VESTIDO,AMBIANCE APPAREL,147,113,2024-07-04,Inventariable,Pieza,50002023,TRUE
AMB-0103,2024,PANTALON DE ENCAJE BURDEOS,,,,PANTALON,AMBIANCE APPAREL,216,166,2024-07-04,Inventariable,Pieza,50002024,TRUE
ONT-0072,2025,CARDIGAN CON LAZADA AZUL MARINO,,,,CARDIGAN,ONTWELFTH,529,460,2024-07-04,Inventariable,Pieza,50002025,TRUE
ONT-0073,2026,SHORT DE TEJIDO DENIM MOSTAZA,,,,SHORT,ONTWELFTH,374,325,2024-07-04,Inventariable,Pieza,50002026,TRUE
ONT-0074,2027,SHORT CON CUELLO EN V TERRACOTA,,,,SHORT,ONTWELFTH,304,253,2024-07-04,Inventariable,Pieza,50002027,TRUE
ONT-0075,2028,VESTIDO SATINADO BLANCO,,,,VESTIDO,ONTWELFTH,396,344,2024-07-04,Inventariable,Pieza,50002028,TRUE
ONT-0076,2029,VESTIDO CON ESTAMPADO FLORAL LILA,,,,VESTIDO,ONTWELFTH,502,436,2024-07-04,Inventariable,Pieza,50002029,TRUE
ONT-0077,2030,BLUSA DE TEJIDO DENIM MOSTAZA,,,,BLUSA,ONTWELFTH,483,420,2024-07-04,Inventariable,Pieza,50002030,TRUE
ONT-0078,2031,BLUSA PLISADO VERDE ESMERALDA,,,,BLUSA,ONTWELFTH,506,440,2024-07-04,Inventariable,Pieza,50002031,TRUE
ONT-0079,2032,FALDA DE ENCAJE AZUL CIELO,,,,FALDA,ONTWELFTH,441,383,2024-07-04,Inventariable,Pieza,50002032,TRUE
ONT-0080,2033,SHORT AJUSTADO AZUL MARINO,,,,SHORT,ONTWELFTH,440,382,2024-07-04,Inventariable,Pieza,50002033,TRUE
